Job Title,Salary Estimate,Job Description,Rating,Company Name,Location,Headquarters,Size,Founded,Type of ownership,Industry,Sector,Revenue,Competitors
Software Engineer - Python,-1,"_Do you love building world-class software? Do you enjoy tackling challenges head-on and digging into technology stacks to solve problems? _

_Are you passionate about writing high-performing code that scales well? _

_Do you want to be part of a collaborative team that thinks differently? _

If so, we need you to be our new *Python Software Engineer*. The Software Engineer is a vital member of our tech team, working across the software development life cycle to bring us high-performing and scalable software solutions.
Who We Are: * Spire Collective is a team of creators on a mission to help people enjoy their lives. We accomplish this by thinking differently about product design and being a little obsessed with continuous improvement - for ourselves, our team, our products, and our customers. Founded in 2009 as a bootstrapped team of 1, we have developed into a growing company with a current team of around 20. It all started with StoreYourBoard, our award-winning product design and eCommerce brand, creating and delivering the products that help outdoor-enthusiasts around the world make time for adventure. With our headquarters just east of Charlottesville in Troy, VA, we’ve built a culture around shared core values such as always improving, thinking differently, and “do it in-house.” Join us on our journey to becoming a globally recognized brand!
Who You Are: * An innovative self-starter with a passion for technology and a keen interest in eCommerce. You excel in a smaller, collaborative team, owning your area and stepping up to the challenges that come with it. A successful candidate will bring a growth-oriented mindset and the ability to thrive in a fast-paced and ever-changing entrepreneurial environment.
The Opportunity: *The Software Engineer will be our in-house Python development and data engineering expert. You will lead the upgrade and customization of our Python-based inventory management software, Odoo, to support our operations as an eCommerce business. You will design and implement data pipeline workflows using Apache Airflow to process company data. To be a successful candidate, you excel at synthesizing business priorities with development projects to bring the right solutions to fruition.
Key Responsibilities: *
As the lead developer on a major project to upgrade and customize our Python-based inventory management software (Odoo), you will develop, test, and debug a critical system for our Team
You’ll be responsible for translating our user and business needs into functional Odoo modules using Python, JQuery, PostgresSQL, and XML
You’ll maintain and customize Odoo add-ons, implementing new features, creating customized reports, and building new functional business modules
You’ll design and implement data pipeline workflows using Apache Airflow to process company data
Working closely with our Senior Business Intelligence Analyst, you’ll implement cloud-based Machine Learning platforms to refine our demand forecasting capabilities
Upon completion of these projects, you will operate as our Odoo and Data Platform subject matter expert, maintaining and continuously improving these systems
You’ll have the opportunity to grow into full-stack web application development with a variety of languages which support our internal tools, store front, marketing, fulfillment, customer service, and data analytics functions
You’ll design, develop, test, and deploy new software platforms, tools, and features
You’ll write understandable, testable code with an eye toward maintainability and scalability
You’ll collaborate with the tech team to produce software solutions that meet functional requirements, work well, and are delivered on time
You’ll defend the integrity of the codebase, never compromising on code quality
You’ll become a domain expert in eCommerce by working closely across functional teams and a variety of stakeholders
You’ll promote constant refactoring while developing features or touching existing code to keep the codebase as clean as possible
You’ll learn and adapt continuously to modern technical excellence practices and techniques
You will lead high-impact projects in analyzing available data to develop actionable insights into systems and software performance
You’ll take initiative towards exploring new technologies, identifying opportunities and new practices that positively impact our success
You’ll maintain extensive documentation and create knowledge artifacts in your area of responsibility
Your Qualifications: *
Bachelor’s Degree in Computer Science or related technical field, or relevant equivalent experience
Minimum 4 years’ experience in back end software development
Significant experience with Python development
Experience designing, building, and maintaining data processing systems
Experience coding with PHP, MySQL, Javascript, HTML, and CSS
You Also Bring: *
Strong expertise in Python and SQL
Concrete understanding of object-oriented design and programming
Demonstrated ability to integrate multiple data sources/databases into one system
Solid experience of design principles behind a scalable application, data structure, and API version controlling systems
Excellent analytical and problem-solving skills
Ability to work both independently and as part of team
High level of attention-to-detail and excellent organizational skills
Bonus Points: *
Technical and functional knowledge of Odoo (formerly called OpenERP) modules and features
Some experience working with the Vue.js Javascript framework
Experience programming, scheduling, and monitoring workflows using Apache Airflow
Experience as a full-stack developer for an eCommerce company
To Apply: * Apply directly with your cover letter and resume; let us know why you would be an awesome candidate for this opportunity!
For more information about Spire Collective, our products, and our team, visit our website, LinkedIn company page, and glassdoor page.

Job Type: Full-time

Benefits:
Employee discount
Health insurance
Life insurance
Paid time off
Parental leave
Professional development assistance
Referral program
Retirement plan
Schedule:
8 hour shift
Experience:
Python: 3 years (Preferred)
Work authorization:
United States (Required)
Application Question:
Do you need, or will you need in the future, sponsorship to continue your work authorization?
Work Location:
One location
Work Remotely:
Temporarily due to COVID-19",4.4,"Spire Collective
4.4","Troy, VA",-1,1 to 50 Employees,2009,Company - Private,Sporting Goods Stores,Retail,Unknown / Non-Applicable,-1
"Software Engineer, Entry-Level",-1,"Software Engineer, Entry-Level*
Are you obsessed with software and robotics? Looking to work with an awesome team in a modern, successful software company? Geisel Software, based in Worcester, Massachusetts, is a premier software developer that is working with and creating today's hottest software technologies. We are looking for a motivated individual to join our team, learn new technology, and help us build some great software!

Geisel Software develops web, mobile and embedded software, with a focus on robotics, medical devices, and machine learning. We seek a talented individual who is not afraid to work hard, learn something new and get lots of stuff done. We have a helpful staff, but it is also important that you can work independently and solve problems with little outside direction. Your problem-solving skills will be put to the test, whether that means tracking down the answer on Google, or building your own new solution.
Here's what we work with regularly*
Robotic Simulation with ROS, RVIZ, and Unreal Engine
Embedded Development in C/C++ (Arm or x86)
TensorFlow and OpenCV
LAMP - Linux, Apache, MySQL and PHP
iPhone/Android application development
Web Frontend (AngularJS, JavaScript, jQuery, Bootstrap, etc.)
Scripting Languages (Python, BASH, or other)
Web Technologies - HTML5, CSS3, XML, JSON
Linux - As a user at least, but also administration and kernel development
Web Frameworks - Django, Codeigniter
Agile and Waterfall design methodologies
Embedded platforms (Raspberry Pi, BeagleBone, OMAP, etc.)
Here’s what we require*
You're passionate about software development -- it's what you do even in your free time.
1 - ∞ years of experience with (C++) and (Python, or other modern scripting languages).
Must be a US Person.
Good software foundational skills: clean, well-documented code; collaborative style; solid algorithms understanding; CS theory; mastery of more than one language.
An aptitude for learning new platforms and technologies on the fly. We’re constantly working on new projects that will push you and keep you always learning new technologies.
Able to take ownership of a project and independently architect, execute and troubleshoot it through completion and customer delivery.
Actively pursuing new knowledge and technologies. If you’re a web frontend guru, are you building your backend skills? If you’re an embedded developer, are you developing apps for Android or iOS?
Already comfortable on Linux. You can be a Windows/Mac pro, but you'll be doing at least 50% of your development on Linux. You should be comfortable with that.
Willing to commute to Worcester, MA (Note: Ability to temporarily work remotely during this trying time of COVID-19).
Looking for full-time employment.
What you’ll get*
An opportunity to work with the latest technologies across a variety of platforms.
A fun, exciting work environment focused on the results, not the politics.
An experienced team and mentor who can help you grow in your craft and career.
A position with a growing company, offering competitive benefits and salary.
Apply now*
E-mail us at *jobs*@*geisel.software* and *include your resume and a brief cover letter* explaining why you think you'd be a great fit at Geisel Software. We'd love to hear about what you've done with technologies we're using, or other projects you've worked on. What do you think you’re really good at and why? What have you done outside your current job to improve your craft? Why do you think you’d be a great fit?

Job Type: Full-time

Schedule:
Monday to Friday
Work authorization:
United States (Required)
Application Question:
Will you now, or in the future, require sponsorship for employment visa status (e.g. H-1B visa status)?
Work Location:
One location
Work Remotely:
Temporarily due to COVID-19",5.0,"Geisel Software
5.0","Worcester, MA",-1,1 to 50 Employees,-1,Unknown,-1,-1,Less than $1 million (USD),-1
Software Engineer - Adobe Multi Solutions - Remote,$37K-$80K (Glassdoor Est.),"Pay Range: $78,312 - $97,107 annually

Applicants for this position can work remotely from their home! Applicants must live in Nebraska, Kansas, Iowa or Texas however due to store locations and tax purposes.

At NFM, we’ve been hiring friends since 1937—people who share our passion for helping customers feel right at home. If you share our vision, we invite you to be one of us!

People love working here! Glassdoor ranked Nebraska Furniture Mart in the top 50 Best Places to Work in the U.S. and here are a few reasons why:

A FUN, stable work environment, with no lay-offs in our history
A safe place to work and shop
A path to the career of your dreams (career development opportunities)
A culture that encourages volunteering and serving our communities

Job Description: Your Piece of the Puzzle

NFM’s Adobe Multi-Solution Engineer is responsible to be the subject matter expert for Adobe Campaign Standard and other Adobe Experience Cloud Products and Services such as Launch and Analytics. The primary responsibility will be to translate business requirements for these tools into custom implementations by using a combination of custom JavaScript, data layer objects, processing rules, report suite configurations and technical workflows.

Job Duties: A Day in the Life

Plan: Gather and understand unique business requirements and implement the desired solutions
Research: Proactively identify, analyze, and position opportunities to improve digital analytics front-end implementation based on internal and external data
Collaborate: Coordinate final project quality analysis, reporting, transferring of reporting knowledge, provide close-loop communication within the organization including creating senior executive dashboard
Create: Perform extensive testing, create queries to extract and validate segment data and sizing or perform quality analysis testing to validate project test data
Design: Setup new SProps and eVar through Adobe Analytics
Optimize: Act as the owner of Adobe Launch and coordinate with the web-dev team to realize tagging

Your work will directly impact our ability to help people create a lifestyle they love, for the people they love—because that’s what we love.

Benefits: What’s in It for You?

As a full-time member of our NFM Family, you will enjoy:

Competitive pay
Health, dental, vision and life Insurance
Paid holiday and paid time off
Staff discount on merchandise
(Collectively, NFM staff has saved almost $2 million on purchases in the last 12 months)
Tuition reimbursement
Paid training
401(k) with company matching
Short and long-term disability
Employee assistance program
Career development and advancement opportunities
Community volunteer opportunities

NFM is an Equal Opportunity Employer.

Experience
Required
• Bachelors’ Degree in Computer Information Systems, related field required or equivalent experience
• 1+ year of hands on Adobe Campaign Standard experience or 3+ years of marketing campaign development experience on a tool equivalent to Adobe Campaign Standard (Salesforce Marketing Cloud, Cheetahmail, …)
• At least 2 years of experience in software development life cycle
• At least 1 year of experience in translating functional/non-functional requirements to system requirements
• Expertise and Experience in SQL (Oracle / SQL Server / PostgreSQL)
• Experience working with/creating APIs
• Strong understanding of tag management systems and platforms (Adobe DTM/Launch, GTM, Tealium, Ensighten, etc…)
• Excellent understanding of analytics and tag management best practices, including workflows and planning
• Outstanding project management skills with proven experience managing end-to-end projects including managing budget, timelines/milestones, multiple partners and deliverables
• Demonstrated ability to manage simultaneous projects in a fast-paced environment
• Estimation abilities in scoping work in a highly complex environment
• Must be able to work independently and collaboratively (team oriented) with an enthusiastic attitude
• Strong interpersonal, communication and influencing skills
• Problem analysis and problem resolution at both a strategic and a functional level
• Ability to work nights, weekends and/or early morning hours based on business needs
• Pre-employment screening includes, but isn’t limited to, drug screen and criminal background check
Preferred
• Proficient in Adobe Launch
• Experience migrating Tag Management Systems
• Experience with on-demand reporting/Analysis/business intelligence tools, including Tableau, etc…
• Experience with Commerce Cloud
• Experience with Adobe Campaign, Adobe Target, or other Adobe Solutions (Audience Manager, AEM)
• Experience with Agile development philosophy, practices, and tools
• The right mix of experience in Marketing and Technology is highly desirable
• Adobe Analytics Certification – Certified Expert, Business Practitioner; Certified Expert, Technical Architect
• 2 years of technical workflow development experience in Adobe Campaign Standard and 4 years in a related tool (Salesforce Marketing Cloud, Cheetahmail, …)
• 3+ years’ experience with Web Analytics Tools
• 2 years+ experience in JavaScript and Various JavaScript libraries and Experience in Workflow (Import, export, maintenance, data extraction)
Education
Preferred
Bachelor's Degree or better in Computer Science or related field",3.3,"Nebraska Furniture Mart
3.3","Omaha, NE",-1,1001 to 5000 Employees,1937,Subsidiary or Business Segment,Home Furniture & Housewares Stores,Retail,$1 to $2 billion (USD),-1
Software Engineer,$46K-$98K (Glassdoor Est.),"Aircraft component OEMs, MRO facilities and operators depend on Testek Solutions for highly reliable aerospace test equipment to certify hydraulics, power generation, avionics, fuel, lube, actuator, and pneumatic components. With a 50-year track record of success, Testek uniquely holds long-term OEM partnerships, provides the industry’s leading equipment warranty, and support from a dedicated worldwide team.
We are actively seeking a Software Engineer and the sky is the limit with Testek Solutions! The selected candidate will develop and maintain software applications for Testek Solutions product portfolio.
Job Responsibilities:
Develop software for projects through the Route66 project development lifecycle
Review product test procedures and develop automated test sequences and reports
Review electrical and hydraulics schematics and configure software applications for Test Stands
Debug, Test and provide support to verify Test Stands meet project requirements
Provide software debug and upgrade services for Aftermarket projects
Maintain and upgrade software product revisions and revision history
Participate in customer reviews
Provide technical support and estimations for sales proposals
Conduct internal and external training on software applications
Conduct internal audits
Requirements:
Bachelor’s degree (required) in Electronics or Instrumentation (highly preferred)
A minimum of 2 years of experience with LabVIEW (hands-on)
Proficiency with Lab Equipment to include voltmeter, ammeters, signal generators, and oscilloscope
Experience with Configuration Management Tools, technical documentation, work estimation, and scheduling
Must be a US Citizen or Green Card Holder (ITAR compliance requirement)

Testek Solutions requires all new hires submit and pass a pre-employment drug screen, credit check (when applicable), and background check prior to beginning employment.
Testek Solutions is an affirmative action and equal opportunity employer. All qualified applicants will receive consideration for employment without regard to race, color, religion, sex, disability, age, sexual orientation, gender identity, national origin, veteran status, height, weight, genetic information, or any other classification protected by federal, state, or local law. Testek Solutions is committed to providing access, equal opportunity and reasonable accommodation for individuals with disabilities in employment, its services, programs, and activities. To request reasonable accommodation, contact the Testek HR Department at 248-573-4980 or email hrdept@testek.com",4.4,"Testek Solutions
4.4","Wixom, MI",-1,51 to 200 Employees,1969,Company - Private,Aerospace & Defense,Aerospace & Defense,$50 to $100 million (USD),-1
Software Engineer,$41K-$88K (Glassdoor Est.),"Pittsburgh, PA, USA
Full Time

Email Me This Job

THE GIG


RoadRunner is looking to hire a well-rounded and ambitious full-stack engineer to join our team!

We currently manage Recycling and Waste Management in multiple markets and are looking to grow our operation and technology this year. RoadRunner is planning to change the way people recycle while introducing tech into the industry that has never been done. We operate with many moving parts and there is no shortage of areas to improve on with excellent engineering.

We are looking for a grounded, ambitious, and detail-oriented software developer. Solid computer science fundamentals is required as well as an openness to use different technologies. Exposure to full-stack web development is a requirement for this position as well as experience with at least one popular front-end framework.

The main objective of this position is to build the foundation for RoadRunner's customer-facing applications. For the past two years, we have centered our technology around the core internal operations of the business. However, as we grow into more markets and productize our services, we will need to build a suite of applications for our clients.

RoadRunner is looking to provide a top-notch customer experience and the technology to back it up. You will work alongside a variety of disciplines including sales, design, and operations to develop high quality products. You will gain valuable system level experience as you integrate your work with our current technology and have the opportunity to develop brand new green-field projects.

Not only is this a great opportunity to help us grow our tech stack, but you'll also learn a lot about the Recycling and Waste Management industry and have the opportunity to be part of a growing startup.


REQUIREMENTS
Exposure to full-stack web development
Experience with at least one popular front-end framework

PERKS & BENEFITS
Full benefits package including health, dental, and vision insurance
401k
Commuter Benefits
Paid company holidays.
Company events, annual off-site retreat, happy hours, and other social events.
15 Paid Time Off days per year + 2 personal floating holidays
Outstanding company culture.
RoadRunner Recycling is an affirmative action and equal opportunity employer and is committed to the full inclusion of all qualified individuals. All qualified applicants will receive consideration for employment without regard to race, color, religion, sex, disability, age, sexual orientation, gender identity, national origin, veteran status, or genetic information. It is the policy of RoadRunner Recycling that qualified individuals with disabilities not be discriminated against because of their disabilities in regard to job application procedures, hiring, and other terms and conditions of employment. It is further the policy of RoadRunner Recycling to provide reasonable accommodations to qualified individuals with disabilities in all aspects of the employment process. RoadRunner Recycling is prepared to modify or adjust the job application process or the job or work environment to make reasonable accommodations to the known physical or mental limitations of the applicant or employee to enable the applicant or employee to be considered for the position he or she desires, to perform the essential functions of the position in question, or to enjoy equal benefits and privileges of employment as are enjoyed by other similarly situated employees without disabilities, unless the accommodation will impose an undue hardship. To request reasonable accommodation, please contact our Human Resources department at RoadRunner Recycling, at HR@roadrunnerwm.com.

RoadRunner Recycling Inc.
https://roadrunnerwm.isolvedhire.com",4.2,"RoadRunner Recycling
4.2","Pittsburgh, PA",-1,51 to 200 Employees,2014,Company - Private,Building & Personnel Services,Business Services,Unknown / Non-Applicable,-1
"Software Engineer, Full-Stack",-1,"We're looking for full stack web developer to help create a new web application that enables security analysts to understand their external network perimeter. We perform billions of network handshakes and DNS lookups per hour as well as consume external data feeds to maintain an up-to-date view of all hosts and networks on the Internet. You will help build the application and APIs that enable researchers and analysts to explore and draw security insight from this data. This spans building APIs and services on top of backend database like Elasticsearch, BigTable, and Spanner to working with frontend designers and developers to write Javascript code. You will be joining a small, energetic team in Ann Arbor, MI.

The types of things you'll do:

Develop customer-facing web apps in Node.js, Python, TypeScript/JavaScript, HTML, and CSS
Partner with product and design teams to build and launch new products
Collaborate with the data engineering team to translate Censys data into customer facing features
Design automated solutions for building, testing, monitoring, and deploying applications in a continuous integration environment.
Solve problems across multiple codebases and technologies
Desired Qualifications
Bachelor's degree in Computer Science or related field, or equivalent experience
3+ years of industry experience building web applications in HTML5, CSS, and Javascript Frameworks (e.g., Angular, React, Vue)
Experience with backend web frameworks (e.g., Rails, Django, Pyramid)
Experience with object- oriented languages (e.g., Python, Ruby, or Java)
Familiarity with SQL (e.g., PostgreSQL) or NoSQL stores (e.g., Cassandra)
We value diversity and are committed to creating an inclusive environment for all employees. Censys is an equal opportunity employer.",5.0,"Censys
5.0",Remote,-1,1 to 50 Employees,2017,Company - Private,Enterprise Software & Network Solutions,Information Technology,Unknown / Non-Applicable,-1
